{
  "schema_version": 3,
  "id": "architecture.camilobuilder",
  "record_version": "2.0.1",
  "architecture_version": "1.3.0",
  "status": "active",
  "contract_ids": [
    "contract.capability-introspection",
    "contract.cli-public-interface",
    "contract.component-generation-safety",
    "contract.constitutional-audit",
    "contract.default-generated-content",
    "contract.governance-policy",
    "contract.governance-schema",
    "contract.public-facade",
    "contract.template-rendering",
    "contract.template-resolution"
  ],
  "modules": [
    {
      "id": "module.builders",
      "paths": [
        "builders"
      ],
      "stability": "stable",
      "responsibilities": [
        "Build projects and components",
        "Catalog generated components",
        "Preserve idempotence, existing files, and customized content",
        "Validate component names and destinations"
      ],
      "provides_contract_ids": [
        "contract.component-generation-safety"
      ],
      "consumes_contract_ids": [
        "contract.default-generated-content",
        "contract.template-rendering",
        "contract.template-resolution"
      ],
      "allowed_dependency_ids": [
        "module.template-catalog",
        "module.template-system"
      ],
      "prohibited_dependency_ids": [
        "module.capability-introspection",
        "module.cli",
        "module.constitutional-audit",
        "module.governance",
        "module.public-facade"
      ]
    },
    {
      "id": "module.capability-introspection",
      "paths": [
        "capability_introspection"
      ],
      "stability": "experimental",
      "responsibilities": [
        "Derive deterministic self-knowledge from executable and governed canonical sources",
        "Read governance records without writing, migrating, or changing their state"
      ],
      "provides_contract_ids": [
        "contract.capability-introspection"
      ],
      "consumes_contract_ids": [
        "contract.cli-public-interface",
        "contract.default-generated-content",
        "contract.governance-schema",
        "contract.template-resolution"
      ],
      "allowed_dependency_ids": [
        "module.builders",
        "module.cli",
        "module.governance",
        "module.template-catalog",
        "module.template-system"
      ],
      "prohibited_dependency_ids": [
        "module.constitutional-audit",
        "module.public-facade"
      ]
    },
    {
      "id": "module.cli",
      "paths": [
        "builder_cli.py"
      ],
      "stability": "stable",
      "responsibilities": [
        "Build the command-line parser",
        "Coordinate command handlers with builders and template services",
        "Preserve public messages, JSON, and exit codes",
        "Register commands declaratively"
      ],
      "provides_contract_ids": [
        "contract.cli-public-interface"
      ],
      "consumes_contract_ids": [
        "contract.component-generation-safety",
        "contract.template-rendering",
        "contract.template-resolution"
      ],
      "allowed_dependency_ids": [
        "module.builders",
        "module.template-system"
      ],
      "prohibited_dependency_ids": [
        "module.capability-introspection",
        "module.constitutional-audit",
        "module.governance",
        "module.public-facade"
      ]
    },
    {
      "id": "module.constitutional-audit",
      "paths": [
        "constitutional_audit"
      ],
      "stability": "experimental",
      "responsibilities": [
        "Expose manual assertions and unverified obligations separately",
        "Produce deterministic reports from governed local sources",
        "Verify automated technical controls without side effects"
      ],
      "provides_contract_ids": [
        "contract.constitutional-audit"
      ],
      "consumes_contract_ids": [
        "contract.capability-introspection",
        "contract.governance-policy",
        "contract.governance-schema"
      ],
      "allowed_dependency_ids": [
        "module.capability-introspection",
        "module.governance"
      ],
      "prohibited_dependency_ids": [
        "module.builders",
        "module.cli",
        "module.public-facade",
        "module.template-catalog",
        "module.template-system"
      ]
    },
    {
      "id": "module.governance",
      "paths": [
        "governance"
      ],
      "stability": "experimental",
      "responsibilities": [
        "Define architectural boundaries without participating in execution",
        "Store constitutional, schema, and governance records"
      ],
      "provides_contract_ids": [
        "contract.governance-policy",
        "contract.governance-schema"
      ],
      "consumes_contract_ids": [],
      "allowed_dependency_ids": [],
      "prohibited_dependency_ids": [
        "module.builders",
        "module.capability-introspection",
        "module.cli",
        "module.constitutional-audit",
        "module.public-facade",
        "module.template-catalog",
        "module.template-system"
      ]
    },
    {
      "id": "module.public-facade",
      "paths": [
        "builder.py"
      ],
      "stability": "stable",
      "responsibilities": [
        "Delegate command-line implementation",
        "Maintain the public entry point and facade"
      ],
      "provides_contract_ids": [
        "contract.public-facade"
      ],
      "consumes_contract_ids": [
        "contract.cli-public-interface"
      ],
      "allowed_dependency_ids": [
        "module.cli"
      ],
      "prohibited_dependency_ids": [
        "module.builders",
        "module.capability-introspection",
        "module.constitutional-audit",
        "module.governance",
        "module.template-catalog",
        "module.template-system"
      ]
    },
    {
      "id": "module.template-catalog",
      "paths": [
        "templates"
      ],
      "stability": "stable",
      "responsibilities": [
        "Define stable default generated content",
        "Store integrated declarative template content"
      ],
      "provides_contract_ids": [
        "contract.default-generated-content"
      ],
      "consumes_contract_ids": [],
      "allowed_dependency_ids": [],
      "prohibited_dependency_ids": [
        "module.builders",
        "module.capability-introspection",
        "module.cli",
        "module.constitutional-audit",
        "module.governance",
        "module.public-facade",
        "module.template-system"
      ]
    },
    {
      "id": "module.template-system",
      "paths": [
        "template_system"
      ],
      "stability": "stable",
      "responsibilities": [
        "Apply path, symbolic link, escape, and non-overwrite protections",
        "Preserve binary files and render text variables",
        "Register, resolve, and validate templates"
      ],
      "provides_contract_ids": [
        "contract.template-rendering",
        "contract.template-resolution"
      ],
      "consumes_contract_ids": [
        "contract.default-generated-content"
      ],
      "allowed_dependency_ids": [
        "module.template-catalog"
      ],
      "prohibited_dependency_ids": [
        "module.builders",
        "module.capability-introspection",
        "module.cli",
        "module.constitutional-audit",
        "module.governance",
        "module.public-facade"
      ]
    }
  ]
}
